{
  "id": "curacao",
  "name": "Curaçao",
  "place": "Curaçao",
  "region": "Southern Caribbean",
  "coordinates": [
    -69,
    12.2
  ],
  "peoples": "Caquetío communities",
  "summary": "A Dutch commercial hub with two British interludes.",
  "notes": "An autonomous country within the Kingdom of the Netherlands since 2010. A country within the Kingdom is not an independent sovereign state.",
  "sources": [
    "ws-curacao",
    "dutch-status"
  ],
  "initialController": "indigenous",
  "initialSovereign": "indigenous",
  "events": [
    {
      "id": "curacao-01",
      "date": "1499",
      "precision": "year",
      "kind": "claim",
      "title": "Spain claims the island",
      "detail": "Alonso de Ojeda’s voyage reached the Caquetío islands.",
      "controller": null,
      "sovereign": null,
      "sources": [
        "ws-curacao"
      ],
      "claimant": "spain",
      "qualification": "A European claim; it does not establish island-wide administration or extinguish Indigenous rights."
    },
    {
      "id": "curacao-02",
      "date": "1527",
      "precision": "year",
      "kind": "settlement",
      "title": "Spanish colonial administration",
      "detail": "Juan de Ampués’s administration followed slaving raids and forced removals.",
      "controller": "spain",
      "sovereign": "spain",
      "sources": [
        "ws-curacao"
      ],
      "uncertainty": "A gradual process; this marks administration rather than first European arrival."
    },
    {
      "id": "curacao-03",
      "date": "1634",
      "precision": "year",
      "kind": "capture",
      "title": "The Dutch West India Company takes Curaçao",
      "detail": "A Dutch expedition displaced the small Spanish administration.",
      "controller": "netherlands",
      "sovereign": "netherlands",
      "sources": [
        "ws-curacao"
      ]
    },
    {
      "id": "curacao-04",
      "date": "1648-01-30",
      "precision": "day",
      "kind": "treaty",
      "title": "Spain recognizes Dutch possession",
      "detail": "The Peace of Münster recognized the Dutch colonial holding.",
      "controller": null,
      "sovereign": "netherlands",
      "sources": [
        "ws-curacao"
      ]
    },
    {
      "id": "curacao-05",
      "date": "1800-09-13",
      "precision": "day",
      "kind": "capture",
      "title": "British protection becomes occupation",
      "detail": "A French assault prompted the Dutch authorities to accept British control.",
      "controller": "britain",
      "sovereign": "netherlands",
      "sources": [
        "ws-curacao"
      ]
    },
    {
      "id": "curacao-06",
      "date": "1803-01-13",
      "precision": "day",
      "kind": "restoration",
      "title": "Dutch government restored",
      "detail": "The Treaty of Amiens ended the first British occupation.",
      "controller": "netherlands",
      "sovereign": "netherlands",
      "sources": [
        "ws-curacao"
      ]
    },
    {
      "id": "curacao-07",
      "date": "1807-01-01",
      "precision": "day",
      "kind": "capture",
      "title": "Britain seizes the island",
      "detail": "A British naval attack began a second occupation.",
      "controller": "britain",
      "sovereign": "netherlands",
      "sources": [
        "ws-curacao"
      ]
    },
    {
      "id": "curacao-08",
      "date": "1816-03-04",
      "precision": "day",
      "kind": "restoration",
      "title": "The Dutch return",
      "detail": "Post-Napoleonic restitution was implemented after the 1814 agreement.",
      "controller": "netherlands",
      "sovereign": "netherlands",
      "sources": [
        "ws-curacao"
      ]
    },
    {
      "id": "curacao-09",
      "date": "1954-12-15",
      "precision": "day",
      "kind": "status",
      "title": "The Kingdom Charter",
      "detail": "The Netherlands Antilles obtained internal autonomy within the Kingdom.",
      "controller": null,
      "sovereign": null,
      "sources": [
        "ws-curacao"
      ]
    },
    {
      "id": "curacao-10",
      "date": "2010-10-10",
      "precision": "day",
      "kind": "status",
      "title": "Autonomous country in the Kingdom",
      "detail": "Curaçao became a constituent country as the Netherlands Antilles dissolved.",
      "controller": null,
      "sovereign": null,
      "sources": [
        "dutch-status"
      ]
    }
  ]
}
